{
	"$schema": "http://json-schema.org/draft-07/schema#",
	"$id": "request-transform.schema.json",
	"title": "Graph Rewriting Request Schema",
	"type": "object",
	"additionalProperties": false,
	"properties": {
		"hostgraph": {
			"$ref": "graph.schema.json"
		},
		"rules": {
			"type": "array",
			"items": {
				"$ref": "rewrite-rule.schema.json"
			}
		},
		"sequence": {
			"type": "array",
			"items": {
				"anyOf": [
					{
						"$ref": "run-config.schema.json"
					},
					{
						"$ref": "run-nested-config.schema.json"
					}
				]
			}
		},
		"options": {
			"type": "object",
			"properties": {
				"returnHistory": {
					"description": "If set to true, the resultset will include the exported hostgraph after each rewriting step in chronological order.",
					"type": "boolean",
					"default": false
				}
			},
			"additionalProperties": false
		}
	},
	"required": ["hostgraph"]
}
